{
  "schema": "qspquest.capability-catalog/v1",
  "package_version": "0.1.0",
  "scope": "Source-declared supported contracts; active build/deployment, request admission and exact release evidence determine executable and qualified status.",
  "key_dimensions": [
    "operation",
    "interface",
    "estimator",
    "solver",
    "target",
    "execution_mode"
  ],
  "source_snapshot": {
    "Cargo.toml": "770cdaad24a9f526ff02fdece2326e2e5bea293f30c69dae89ea3891cd9a0828",
    "bindings/cli/src/main.rs": "ebab89be5a4eba85bb3d47dc317a3313a00868090cb2877b92ee0e85fe18c0c5",
    "bindings/mcp/Cargo.toml": "4256b8751db2f1fba7768d90ead78f0009439f5f1e1bc979e587cea08d606c1e",
    "bindings/mcp/Dockerfile": "152ef1530703f75e39f4b26058582669200fc6f243e2fd8b561f2393d3fa338e",
    "bindings/mcp/assets/library/catalog.json": "da147cf9db14c23e0ea6a6dc185946d8b58951582600d7e094e08cff36f08a13",
    "bindings/mcp/assets/library/models/qspquest_diffdose_2026_bite_benchmark/0.1.0/evidence.json": "f4a76255a61d4d5dffec77bdb66f8e1c22d4f96ac7840b06d1639e13e05223ee",
    "bindings/mcp/assets/library/models/qspquest_diffdose_2026_idr_benchmark/0.3.0/evidence.json": "15d79cb03f9116b5270cf2f2563178e8f9b1a5c453873c4cb2201ca152d084c2",
    "bindings/mcp/assets/library/models/qspquest_diffdose_2026_tgi_benchmark/0.1.0/evidence.json": "52235f1405b414c11e7b4431a60ccc41bbf8517ccdc1afc1140a9ad7f72c76d9",
    "bindings/mcp/assets/library/models/qspquest_liu_2026_aav_mab_targetx_rat_brain_full_qsp/2.1.2/evidence.json": "7764e94f911a805d0fb542fb1daf5a8c4f607a4b22d07c486509c815e1b1c7e0",
    "bindings/mcp/assets/library/models/qspquest_rajwade_2026_aav8_trastuzumab_nonlinear_pbpk/0.1.0/evidence.json": "55055efe1971a2bfbda6d23c1b9c496ef322937f5ecbf2f779e8544f85c733d6",
    "bindings/mcp/assets/library/models/qspquest_ubi_2026_membrane_ternary_binding/0.1.2/evidence.json": "05955b89248690dbae9560d9394c50fe2887da64ab51b3e5f3d2faee59f5c473",
    "bindings/mcp/assets/library/models/qspquest_ubi_2026_target_gated_cargo_qsp/2.0.0/evidence.json": "1544d154fb20da5535fe0b4a58abea014f45e13bf622f48a8ad111d083f3dce6",
    "bindings/mcp/assets/library/models/qspquest_yuan_2026_cd3x5t4_in_vitro_qsp/2.0.1/evidence.json": "5f5bc66430a82d7cea07d98b478e372826dfa03de77ae380e76eb164ad6cb1f3",
    "bindings/mcp/assets/library/qspquest_models/availability.json": "1b39fc34c69ccf6e568c095f06cd8f2959f3c76a34c63e6ffa825fbdf7dc4bb0",
    "bindings/mcp/build.rs": "5099dc2d9f1b7a2ab2d0c9fa753a9e2fc748cd1718f91acd7b011c6e037a54a0",
    "bindings/mcp/src/artifacts.rs": "418274f5db950a267c40fa3e75a16793672f6235550532b20273ad81145d1cc2",
    "bindings/mcp/src/availability.rs": "4f99322470089705d04e34ab2fbb7eaa73cf978a0c9afcaf3acf0bdf466df149",
    "bindings/mcp/src/boundaries.rs": "878b79e050f6f9fdc7021d3102e828b827569b306a7b629a290c6b8905c2a9bf",
    "bindings/mcp/src/cache.rs": "4f2ea6a171e625c51623b177eb818c6155cc6f075d9050b578c2df121e1a3759",
    "bindings/mcp/src/cache_fs.rs": "0822929008c4a72fc1ad0c3c86a1b385fcccd5c8e2a6f02155e529b65d17085d",
    "bindings/mcp/src/capability.rs": "6ee9679d4bcba78e700c6a6fcea53c98bf2c4d5008c8ce2e2e1cecdd5e6680e3",
    "bindings/mcp/src/contract.rs": "e82b2968747cc3303c048a1e555515d580c2a0e44996f082fa77ea59c90069c1",
    "bindings/mcp/src/core/analysis_request.rs": "7720752a5c9e3dd9183fd02af63ee0dcd1e3d01a1e4b30ca1bd7eb277889dde3",
    "bindings/mcp/src/core/compute.rs": "43d648c9191d55b091a52d9871ef3a08d1e4635555e124348a8fbf60aa0c7f19",
    "bindings/mcp/src/core/individual_request.rs": "3d2fd0eccbcd2bc286dd21497ca666e77943f26bc47cb89c036c491afa55f864",
    "bindings/mcp/src/core/input_names.rs": "9c745f0928f3cc9fe3ead80800639c4af690f39704ba07172d09af535307d5f3",
    "bindings/mcp/src/core/input_shapes.rs": "497b8dcc01d09deeb95431934acd612e897ede9c82c4266957f15a516ef6a22c",
    "bindings/mcp/src/core/mod.rs": "6e3544eed0b79bf36de8a9cd70c7e94fafb1eb2dac60552ddce34724ddcb7b90",
    "bindings/mcp/src/core/overrides.rs": "138903279c0ddccc77b8be86070a8a9a665c10abb22ba18941de75a0ff58ac68",
    "bindings/mcp/src/core/population_records.rs": "60ed2334e0e5b3b45645c399b500bacc78ae380ec9c5a7f5abf70c51f88a00f0",
    "bindings/mcp/src/core/readouts.rs": "bbb13030e09a50f1dde70931045be50e0c08294fcc4c6fefde9484254833e6cb",
    "bindings/mcp/src/core/required_outputs.rs": "7a9e480a5470840ac76e4b6639e3160db62a5afe58ebcc53a43c7f96f77a7c79",
    "bindings/mcp/src/core/scalar_request.rs": "61e1ca8a96755e1b294f94e8f077c84a16a8594a53be6c2989625d81299c0031",
    "bindings/mcp/src/core/scan_request.rs": "aa07c8283b1eb857a16243822f0bf450250937fe08b51cd86a9b03b65608936e",
    "bindings/mcp/src/core/time_validation.rs": "8c8841dd3f1cb54191bea70ef9e9e6364e57d38e4ea537e99ca278eaa81852ce",
    "bindings/mcp/src/core/usability.rs": "43263f0a337599d2c92727d00be922258052d7a9fdad74e7b78af38d86a83924",
    "bindings/mcp/src/discovery.rs": "57899689ce5d53530464d3c349b8ae8325ee74ebd5a3f58aa999e23654a85840",
    "bindings/mcp/src/execution_policy.rs": "077f047303f4134c5328b320a4f2eefe30a37801ca3b4717234959155c93ae26",
    "bindings/mcp/src/export.rs": "7b741cfb80669c32b11145650cbf23575f37d8e068e70b53474998a9e6b77c68",
    "bindings/mcp/src/fitting.rs": "cbfce5608a7dd24652f7033321732cec76a96cc15759ffd660d648eeb4d4b7b9",
    "bindings/mcp/src/initialization.rs": "bce5578bb1648f4fbea596c3abdf8a3693c0b5d9a48f6bb03e97fce4ae3a6f1d",
    "bindings/mcp/src/inspection.rs": "152b1e9a75f67a57da69089f6ce6d4c4d37cce3030f7be70945f989139a27c40",
    "bindings/mcp/src/interpretations.rs": "15228f2454d0decb86787ead18e243ba3cc53960392534637d1a57e8d55f4c8f",
    "bindings/mcp/src/jobs.rs": "426148183bda0c9b79c2469615684a09f6565c81b57baeb17e711554c6ec1f23",
    "bindings/mcp/src/jobs/request.rs": "b3222fdce94200227e8c95c97eab71114e5056984e4df26c7985481db82487ec",
    "bindings/mcp/src/lib.rs": "77749489084300e01f9af37c9257e7c9644ef7cf4e714e5de954f79a72eaa5f1",
    "bindings/mcp/src/library.rs": "bd54edb6b2af9488da73bc876670847e2a7ea1b575ba7ca8963381193e1a68b2",
    "bindings/mcp/src/local_fs.rs": "246b2d71fcdfd064d572f7a2dcc31cbcd9702c5d78f3b0dc02188a0d0ada6e5d",
    "bindings/mcp/src/local_jobs.rs": "53ad41ee522b76df4d49e86abb87facbfbc87162f397c9ecbbea4908a565d34b",
    "bindings/mcp/src/main.rs": "ab1d6792a6fd7b5fea647d602e8537dfc077f652c54e444f2a342b6f1739a805",
    "bindings/mcp/src/managed_artifacts.rs": "a6b10058b16e667637c28ececc484df88bd1873344fa31b27b92f81aeab8683c",
    "bindings/mcp/src/model_cards.rs": "65418edc9fc92fe921e2191663baefb8d47b657614fbf14fc6067c005aab330c",
    "bindings/mcp/src/planning.rs": "595f85f301e1e6197f2d5079d5c6f4185b46df479230deb87699f6771ef71daf",
    "bindings/mcp/src/policy.rs": "643752e1c9468d061711a0b2b1e3bb38c41c9773e17df0893c60d66efe88fb5f",
    "bindings/mcp/src/precision.rs": "dca889a91ba1e7286e21750e6fcec7053b1fe2943bd24ddf0bcf30521d4b5f74",
    "bindings/mcp/src/response_format.rs": "f66af9ee9680b543e258c50654c95107b127e3a05172eebd6b510d1dc67499b2",
    "bindings/mcp/src/scientific.rs": "44e135c246ea668bbd93d45965f21ae4828c05a1351248bc0d9f8eacfadd2906",
    "bindings/mcp/src/server.rs": "8dc169c535dc603849aa42a0141938672f701c8edea04c44c205afb97ddff441",
    "bindings/mcp/src/server/execution.rs": "3690057eb29d1fcc05e0c169fbc90487772a648a68de58e0764e9f38cd6b79e8",
    "bindings/mcp/src/server/local_jobs.rs": "da220964cac1d101da9a8c51a4e785b9a4176aa2e06580ddebc444bdbae3a74b",
    "bindings/mcp/src/server/managed.rs": "843eea426555537afa0d5089a94a54cf5a054de9fe0d7087f955d5ef7f06c7f9",
    "bindings/mcp/src/table.rs": "b1e613bdca4a993cd9ebc817cc964ec55c1554f332fa3ad215c5a9371c94c758",
    "bindings/python/python/qspquest/__init__.py": "6848b2953561b540264cb17e9a51374e2b5f191f3005ebaa0a34fe9389bb06d7",
    "bindings/python/python/qspquest/control.py": "62dd5d60c4693e7a9c7773c7f1a35d5f3abdcc1d1ff663e7e4fb4e3c436f9d94",
    "bindings/python/python/qspquest/derivatives.py": "66934b42a97abe9e056862493f9e1601331c95caf9334a1324d5ddcf8d6e5936",
    "bindings/python/python/qspquest/diagnostics.py": "1bfa6628c895923f144feed054e3a1fc6ab411a3c1af72523b05e22306b9c924",
    "bindings/python/python/qspquest/estimation.py": "272e344cb928f384afdd77e5037bb61fde67fdca8c2ceb1dfd7a7e85853fb7ca",
    "bindings/python/python/qspquest/exposure.py": "62829d7ea4c688d505d6f72fc28ae8300432e54750794e4ea5679de7a61a406c",
    "bindings/python/python/qspquest/individual.py": "0abbbee768ef7963ce50e2d5642edca810d338f16e2b237f7bd10ff2780f15b9",
    "bindings/python/python/qspquest/interchange.py": "5ac4895c9a5a7c460cc8fa7789b53e75fafc69a89c514374435a5243912e53a2",
    "bindings/python/python/qspquest/population.py": "006e23aa4830a9498a9e5996b831b623f3b842e6b07a78c94154880f835a999d",
    "bindings/python/python/qspquest/uncertainty.py": "9e6861d987cef988c9f5844246104cee71401b50ed2df87af40a89300a24fae4",
    "bindings/python/src/lib.rs": "aba9df8457e71ebf9d1bce7b2849d6999e800a0b5f0efe54f9fe4674628eb17c",
    "bindings/r/NAMESPACE": "3cec2a0f4429a871f73237bb174716cbae0c2238952809bac57d21a1ac6cf197",
    "bindings/r/R/qspquest.R": "84c1d5d23823ee810e978b5b93d29e3d9173a05e27053b8c1f0ac898b3a631c0",
    "bindings/r/src/rust/src/lib.rs": "d8be1eed7567065507a02c01e8bab8f926df06d9ade896f530bb6599fd4479fd",
    "bindings/wasm/Cargo.toml": "ff17b7ae4b8e65fe893b0e9dc810ddd6a50b4958c5ff90731770f4eb9859ffc5",
    "bindings/wasm/js/client.d.mts": "ef04db2c55ced9e407a5cb622a953fcc6dd2140ab99948823b3ebc213ae089b9",
    "bindings/wasm/js/engine-worker.mjs": "ebdb881635c5fbee6d9a1a70187aa8351cd21f890734ccc5cd7298fe7fb9748f",
    "bindings/wasm/src/browser.rs": "b0b8f4b4535d63d60622c58101930df6a3d9d3e1f9dd51645b95067981e0e224",
    "bindings/wasm/src/lib.rs": "0272b2ffe2b7575391542f4a1e84a3603cd8dec30497badebb629383848e1ec0",
    "bindings/wasm/src/sandbox.rs": "d3212c3d462848974c600793cd84167e3ea9556866b08d75a3780117abd1f433",
    "crates/qspquest-core/src/fit.rs": "84e66b38afc9bed94bd3ac13bd52c460e051e506e171176c1d1a3a1a2e39dd0a",